"","score","review","writer","time","score_asnum"
"656","7","사실 스파이더맨 시리즈 하면 앤드류 가필드 밖에 안 떠올랐는데 이제는 톰홀랜드만 떠올리게 될 것 같다. 거의 완벽한 스파이더맨 같았고 시리즈 중 가장 재밋었다.  ","amyk****","2019.07.03 00:43",7
"657","5","기대하고 봤는데 전편에 비해 좀 실망스럽네요  ","요요(cds3****)","2019.07.02 22:19",5
"658","6","애매하다 이도 저도 아닌 느낌  ","mikaissocoolike(youn****)","2019.07.02 21:31",6
"659","6","그렇게 확 재밌지는 않음 그냥 킬링타임용  ","스파이크(tige****)","2019.07.02 20:54",6
"660","10","돈하나도 안아깝게 재밋게 봄  ","zomo****","2019.07.02 20:05",10
"661","8","갠적인 생각인데  매리제인을  백인 아니고 혼혈배우로 만든게 굉장히 보기가 불편했음.ㅎㅎ 이건 진심 차별이 아니고 원작만화를 좋아했던 독자로서 몰입하기가 너무 힘들었어요..다양성은 좋은데 쓸데없이 억지로 다양성을 추구하는건 안좋다고 생각합니다.  ","PIAO QIXING(pcs8****)","2019.07.02 18:08",8
"662","7","관람객cg만화려하고 별로였습니다.  ","냥죽(dnjs****)","2019.07.02 16:33",7
"663","9","아ㅋㅋ 졸라 웃긴게 니들이 뭐라고 토니스타크를 그리워하냐?ㅋㅋ 누가보면 니들이 뭐라도 되는줄ㅋㅋ 토나오넹ㅋㄱ  ","후하후아(5192****)","2019.07.02 14:23",9
"664","10","역대급이다엔드게임 넘어섰다  ","더운감자(arro****)","2019.07.02 13:21",10
"665","10","역시 스파이더맨 ㅜㅠㅠㅠ N차 찍으러 갑니다  ","첫눈(kmin****)","2019.07.02 10:24",10
"666","10","김토미ㅠㅠ위럽유ㅠㅠ  ","YNVN(wing****)","2019.07.02 10:16",10
"667","10","팡팡 터진다 터져 액션은 터져야 제맛이지!!또볼꺼다 ..  ","세레니티(jjuy****)","2019.07.02 09:50",10
"668","7","어벤져스 히어로들 러버인데 이번 스파이더맨은 호평이 많은게 잘 납득이 안가요 ㅠㅠ 개인적으론 액션 등은 볼만했는데 그 외 나머지는 다 기대 이하였습니다. 어딘가 모르게 유치하다는 생각이 극의 후반부를 갈수록 점점 커져갔던... 쿠키영상도 그렇고요  ","swee****","2019.07.03 10:24",7
"669","1","평점 너무높아서 낮게줌 그냥그랬음  ","별명(wogu****)","2019.07.03 02:25",1
"670","6","6.5점 존왓츠 감독 스파이더맨은 타깃이 초등학생 중학생 인듯 너무 유치하다  ","rlfehdghd(uniq****)","2019.07.02 19:11",6
"671","6","쿠키고 나발이고 끝나자마자 튀어나왔다나쁜놈 설정이 저게 뭐냐? 장난도 아니고...어제 존윅3 보고 이거 봤더니 진짜 재미 별로네 마블은 앤드게임에서 끝!!  ","도연파파(rlaw****)","2019.07.02 18:38",6
"672","8","1편에서는 리즈 좋아한다고 하다가 2편에서는 MJ 좋아한다고 하다니 너무 뜬금없내요.  ","꼬마나무(opnm****)","2019.07.02 15:20",8
"673","1","언제까지 아이언맨 팔아먹기 할거야?스파이더맨 영화 아닌가?  ","fata****","2019.07.02 13:54",1
"674","10","슬프고 화나고 설레고 웃기고 소름돋고 다 있다.. 피터 찌리릿!!!  ","세영공주(jsy2****)","2019.07.02 09:06",10
"675","1","유치하고 노잼. 조연들도 하나같이 극불호  ","스코필드(tago****)","2019.07.03 00:20",1
"676","1","고구마 100개 먹은느낌  ","jeje(ever****)","2019.07.02 22:33",1
"677","2","별한개도아깝다.재미졸라없네  ","min2****","2019.07.02 14:19",2
"678","4","엔드게임 때문에 기대를 너무해서 그런가 좀 별로였어요..  ","배재준(kenz****)","2019.07.02 14:10",4
"679","6","마블 역대 망작인듯.... 헐 진짜 보면서 이렇게 유치해도 되나 싶었음 진짜 마블빠인데 이거 진짜 실화인가?....마블 영화 영화관에서 보는것만으로도 감사하게 생각했는데 와이건 아니다 싶었음 보는 내내  ","카탈레나(chun****)","2019.07.02 14:02",6
"680","10","유튜버들 제발 알고좀 떠들었으면 좋겠다 왜 추측하고 예상하지? 그냥 영화 나오고 보면 되는거 아닌가? 조회수 그렇게 뽑아먹고싶어? 이젠 걍 믿거  ","칼라컬러(sagj****)","2019.07.02 13:21",10
"681","4","노잼 ....  아이들도 재미없어할 이야기 아쿠아맨이 훨씬잼난다.  ","ramb****","2019.07.02 12:45",4
"682","10","아이언맨 2 ost 오마주, 엔드게임 캡틴 오마주, 피터 찌리릿, 그 모든것이 찌릿했습니다..  ","dnjswngh(alex****)","2019.07.02 09:11",10
"683","10","개꿀잼 꼭 보셈 두번보셈  ","내삶의반(rlae****)","2019.07.02 09:01",10
"684","4","관람객이것도 끝물이네요 노잼ㅠ  ","선수(btrv****)","2019.07.03 03:48",4
"685","4","졸려죽는줄 ㅋ힘드네 ㅠ 좀유치  ","소담(elit****)","2019.07.02 23:10",4
"686","6","왤케 지루하지...?  ","dimp****","2019.07.02 21:16",6
"687","2","흠 이제마블도 한물가기시작한다는걸 알려주는영화...제일최악이다  ","쭈니쭈니(gaia****)","2019.07.02 19:10",2
"688","6","방금 봤는데 그전작은 재밌는데 이건몰입도안되고삼류영화같음 돈 내고보지마셈  ","파이(6553****)","2019.07.02 16:22",6
"689","4","재미없음 기대하지 마시길  ","A gusto(jimm****)","2019.07.02 15:52",4
"690","2","실망이옇읍니닺 노잼 입니다  ","갔다버려(ky88****)","2019.07.02 15:44",2
"691","1","진짜 암걸리고 유치해서 보는동안 답답해서 고구마 1000개는 먹는느낌이였고 마블중 스파이더맨은 다신 안보는게 좋을듯  ","시니유(yun_****)","2019.07.03 02:24",1
"692","4","노잼은 아닌데 스파이더맨 원작과는 전혀다른 작품임. 걍 캐릭터만 빌린 수준. 생각없는 애새끼의 표본이 뭔지 보여줘서 암 걸리는줄. 원작의 스파이더맨은 순수한 사람이었는데 감독이 순수한거랑 멍청한거랑 구분 못하는듯  ","안군님(angu****)","2019.07.02 20:52",4
"693","1","스파이더맨은 오리지널이 가장 재밌음...  ","원투펀치(haha****)","2019.07.02 10:15",1
"694","4","반전으로 세대교체을 꾀하다. 하지만 자꾸 산으로 가는 마블.  ","올마이티히터(stap****)","2019.07.02 18:24",4
"695","6","관람객아무리 어려도 우주도 가고 지구에서 전쟁을 했던 얘인데.. 철이 안들게 한 설정 그냥 미스테리오에게 건내주는 장면.. 너무 질질 끈다.. 이건 아니지 그걸 어케 그냥 건내줘  ","CHOIHULEYOUNGJAE(cyc1****)","2019.07.02 16:55",6
"696","1","지루해요 시리즈 중 제일 재미 없음  ","별명(id00****)","2019.07.02 22:40",1
"697","9","보고나면 어벤저스 또보고싶음  ","tkfk****","2019.07.02 09:50",9
"698","6","억지악당 하나 만들어내서 스토리 한 편 떼운느낌이었습니다  ","akkre(issn****)","2019.07.02 19:13",6
"699","2","별로임 엄청 기대햇는데  ","nist****","2019.07.02 15:38",2
"700","1","너무 유치했다....실망이다  ","zzzz132(stoc****)","2019.07.02 14:31",1
"701","4","참을 수 없는 가벼움. 돈 아까움에 몇번 일어서길 참았는지.  ","DadaCYP(dada****)","2019.07.02 16:12",4
"702","10","피터 찌리릿~~~~!  ","Tna(vlvk****)","2019.07.03 14:17",10
"703","10","이 영화는 끝까지 봐야한다... 초기에 가볍게 느껴졌던게 후반부가서 묵직하게 때리다못해 너 이거 계속봐야해!! 하고 뺨때기 연속으로 후려갈기는 전개 ..  ","stellar(dbap****)","2019.07.03 14:16",10
"704","10","유치할수밖에 없는게 주인공이 어리니깐요.. 그 나이때 느끼는 감정 고민 이런걸 따라가니까 그럴수밖에 없죠.. 저는 오히려 그런걸 잘 표현해서 좋았네요ㅎㅎ 토니를 잘 보내주는 영화였던거같아요  ","야니스 아데토쿤보(rgr7****)","2019.07.03 14:14",10
"705","7","하...나는 솔직히 톰 홀랜드표 스파이더맨의 매력이 뭔지 모르겠다  ","dfewfewfgge(bsh8****)","2019.07.03 13:55",7
"706","10","너무 유쾌하고 재미있게...감동동은 덤..영화보는 내내 행복했습니다!시간가는줄도 모르게 영화에 집중되었네요ㅎ  ","핵노잼 쯧쯧(skhj****)","2019.07.03 13:54",10
"707","10","관람객1234567890  ","YASHOT(ljb3****)","2019.07.03 13:52",10
"708","8","관람객재밌긴한데 좀 유치하네요ㅎㅎ  ","억울이(zzkt****)","2019.07.03 13:52",8
"709","10","ㅎㅎ 재밌네요 쿠키 꼭보세요  ","Cct(cct8****)","2019.07.03 13:52",10
"710","7","믿고 즐기는 마블 유니버스!  ","세눈이(kiba****)","2019.07.03 13:49",7
"711","10","배경시기가 약간 혼란스러울 텐데도 내용전개를 잘 풀어나갔고 뭔가 신선했다...역시 마블b내용이 너무 많아서 다시보고 싶다  ","효진(didg****)","2019.07.03 13:48",10
"712","10","토니가 얼마나 피터를 사랑하고 믿었는지 알 수 있고, 영웅이 성장하는 모습 역시 볼 수 있는 영화, 여러가지 스파이더맨 시리즈들중, 16살 스파이더맨의 특색을 잘 살렸다고 생각됨, 결론, 매우 재미있게 보고왔음 :)  ","제일카마스터사장(firs****)","2019.07.03 13:46",10
"713","10","스파이더맨 지금까지 좋아했지만 이번에 파프롬홈 보고나서 더 좋아졌어요...스파이더맨 계속 나왔으면 좋겠다ㅎㅎ  ","ksy7****","2019.07.03 13:45",10
"714","10","관람객기대한만큼 재미있어요!!  ","puru****","2019.07.03 13:20",10
"715","6","관람객액션은 좀 지루했지만 엔드게임보다 더 좋았다. 토니 스타크 없었지만 아이언맨이 너무 많았다. 스파이더맨이 충분하지 않았다..  연기 = 좋다이야기 = 별로  ","Myles Cadle(myle****)","2019.07.03 13:19",6
"716","9","대존잼 쿠키영상 전부 보고 나와야 함!  ","아기네스(leee****)","2019.07.03 13:18",9
"717","10","꿀잼이다 대한민국에서 일빠로 봤다  ","머큐리(tntj****)","2019.07.03 13:18",10
"718","10","진짜 어떻게 이렇게 만들지ㅋㅋ완전 역대급  ","김승우(vosz****)","2019.07.03 13:15",10
"719","9","재미있다 진짜 난 어벤져스보다 더...  ","000000(psm0****)","2019.07.03 13:15",9
"720","10","Peter tingle!  ","박주희(uu74****)","2019.07.03 13:12",10
"721","10","쿠키까지 버릴게 없음.  ","조한(adan****)","2019.07.03 13:12",10
"722","9","관람객재미있고 재밌어요 근데 사이다좀  ","spzk****","2019.07.03 13:11",9
"723","10","피터짠하고 대견하고 기특하고...역시 다음편이 기대되는 마블!  ","서(sens****)","2019.07.03 13:11",10
"724","10","토니스타크 그리워요ㅜ  ","백혜민(bhm3****)","2019.07.03 13:09",10
"725","10","재밌어요 꼭 보세요 ㅎㅎㅎ  ","지원(wldn****)","2019.07.03 13:07",10
"726","10","안볼려했는데 봤습니다. 이 재미있는 영화를 못볼뻔한게 아쉬울뻔했네요  ","숏벨(whdp****)","2019.07.03 13:06",10
"727","10","쿠키 영상 미쳤다..쿠키 영상 꼭 보세요!2개입니더  ","Damon Na(shot****)","2019.07.03 13:05",10
"728","10","마블정말끝이없다 넘재밌게잘봣더  ","강혜원(ggbe****)","2019.07.03 13:04",10
"729","7","관람객하이틴 무비 느낌이 꽤 좋았음 (특히 피터랑 MJ)  ","madn****","2019.07.03 13:03",7
"730","10","마블은 마블이다. 스파이더맨을 이렇게 살릴줄이야ㅋㅋ 애들 꽁냥꽁냥 연애하는 것도 귀여웠음 ㅋㅋㅋ  ","sksm****","2019.07.03 13:02",10
"731","8","재밌게 봤는데 뭔가 아쉽..  ","HJ(vene****)","2019.07.03 13:01",8
"732","10","최고 찌리릿 아이어맨의 애정이 느껴집니다  ","ming****","2019.07.03 12:59",10
"733","10","진짜 개꿀잼ㅎㅎ 아이언맨4인줄 알았어요  ","닭날개(dohy****)","2019.07.03 12:54",10
"734","8","볼만했음.스파이더맨 계속 찡얼대는거 좀 짜증나고MJ금발에 매력적인 케릭터인데..너무 안타깝다  ","꺄꿍(h00n****)","2019.07.03 12:54",8
"735","10","쵝오.... 열번 더 보고싶다  ","happyisdead(sunj****)","2019.07.03 12:54",10
"736","10","쿠키영상때메 뇌정지왔거든요  ","차이차이(calv****)","2019.07.03 12:52",10
"737","10","영상미/스토리는 진심 대박~^^ 흥해라 마블~개봉일날  챙겨 본 보람이 있음!!  ","권Ol(sonn****)","2019.07.03 12:50",10
"738","10","피터 몇 살이나 먹었다고 인생에 고난이 가득하냐...ㅜㅜ 영화는 진짜진짜 재밌었고 담 편이 기다려진다  ","죠(yult****)","2019.07.03 12:50",10
"739","10","4D로 보면 더 재미있었을 것 같아요.상영시간내내 즐거웠어요!  ","diee****","2019.07.03 12:49",10
"740","10","스파이더맨 시리즈가 1개밖에 남지 않았다니,,ㅠ  ","상글하다(skyd****)","2019.07.03 12:47",10
"741","10","재미있다 사랑스럽다 달달하다  ","병굴(byun****)","2019.07.03 12:46",10
"742","10","재밌어요. 스파이더맨은 왠지 우리집 주변에 숨어있을거 같은 캐릭터라 정이 가네요.  ","이샘(mimi****)","2019.07.03 12:45",10
"743","3","관람객돈치들 머신데려와 아오  ","진해(bnm0****)","2019.07.03 11:48",3
"744","7","다른사람들은 전부 다 엔드게임 이후의 인물들인데스파이더맨 혼자만 1편의 인물이군요  ","강상우(sang****)","2019.07.03 11:16",7
"745","8","관람객역시 마블이라 기본 이상으로 재미있긴 함.  ","블랙팬서(v___****)","2019.07.03 10:06",8
"746","8","심의하는 놈들한테 스포당해서 재미 반감됨.엔드게임때처럼 몰매맞아야 정신차릴놈들!  ","침묵한사람(c920****)","2019.07.03 09:58",8
"747","10","조나제임슨 너무 반가웠어! 역시 진정한 빌런!!!  ","매트리스3 내몸로션(meta****)","2019.07.03 03:15",10
"748","10","아니 이거 뭐지 진짜 대박  ","김지우(kjw2****)","2019.07.03 01:02",10
"749","10","진짜 너무좋아 어떠카지  ","냥냥(jaew****)","2019.07.03 01:02",10
"750","8","앤트맨2처럼 본편이 재밌긴 하지만 쿠키가 너무 강력하다  ","슈퍼돼지(jyc1****)","2019.07.03 01:01",8
"751","10","히어로물의 청춘드라마 보는 느낌 그냥 좋았다.  ","연서파파(akig****)","2019.07.03 01:00",10
"752","10","관람객시간가는게 아까워서 자꾸 시간이 신경쓰였다  ","diqd****","2019.07.03 01:00",10
"753","10","진짜 마블영화 대박이다... 바프 떡밥을 여기서 이렇게 풀어낼거라곤 상상도 못했다.. 얼마나 큰 그림이 그려져있는건지.... 거기다 이제야 스파이더맨같네 스라고 느꼈다. 이제 남은 한 편이 토르 라그나로크 같은 진짜 캐릭터의 정체성이 나올거니 기대된다  ","사막(dleh****)","2019.07.03 01:00",10
"754","10","스파이더맨 시리즈 중 가장 재밌고 반전까지 !!! 시간가는줄 몰랐던 !!! 쿠키영상도 ㅠㅠ굿 역시 마블??  ","동글(dmsw****)","2019.07.03 00:59",10
"755","9","충분히 유쾌하고, 영하고 재밌지만아주 약간의 지루함은 덤!  ","율리(amna****)","2019.07.03 00:58",9
"756","10","역시 믿고보는 마블 진짜 꿀잼  ","동현(hops****)","2019.07.03 00:58",10
"757","10","걍 빅재미 대리만족 굿영화보고 첫댓글  ","이계환(leeg****)","2019.07.03 00:56",10
"758","8","어벤져스 엔드게임 이후의 스토리를 연결하기 위해서 약간의 장면마다 개연성이 어색했으나 환영이라는 색다른 액션은 여전히 마블스러운 즐거움이었다! :) 호불호가 있겠지만 충분히 괜찮은 속편이었고 절대로 자리에서 떠나지말고 반드시 쿠키영상까지 즐겨라! :D  ","고라파덕(gora****)","2019.07.03 00:56",8
"759","9","관람객어항이 늘 그러는거 알지만 깨부수고 싶다  ","CATOD(jh95****)","2019.07.03 00:54",9
"760","10","유튜버들 알지도 못하면서 조회수만 끌어 모을라고.. 한번 어거지로 맞추면 자기가 정답인줄 알지  ","레쿤(lecc****)","2019.07.03 00:54",10
"761","10","마블 페이즈4의 새로운 열쇠  ","cjsw****","2019.07.03 00:52",10
"762","10","아이언맨 1 보는기분이였다 ㅠㅠㅠㅠ  ","없습니다(re_a****)","2019.07.03 00:51",10
"763","10","재밌어요. 다음 시리즈 궁금!!  ","레이미(kang****)","2019.07.03 00:51",10
"764","10","관람객넘 재밌게 봤습니다 보너스 영상까지 대박이네요  ","rhythm0112(hwan****)","2019.07.03 00:50",10
"765","10","역대 최고의 스파이더맨 ㅠㅠ 치밀한 액션 동선 구성+cg처리에 초반 도입부는 정말 완벽했습니다.. 전개도 억지가 하나도 없고 중간중간 보이는 토니스타크는 소름이 돋을 정도의 연출이었어요.. 속편 떡밥 회수 기다립니다ㅠㅠ  ","시온(pjw2****)","2019.07.03 00:46",10
"766","7","관람객스파이더맨: 파 프롬 홈  ","hyun****","2019.07.03 00:41",7
"767","10","처음에는 엔드게임의 여운, 실소를 자아내는 개그코드로 보다가 마지막은 눈뽕 액션 덤으로 소름돋는 쿠키영상 마블 팬이라면 꼭 봐야하는 영화.  ","준호(asf2****)","2019.07.03 00:41",10
"768","10","보다가 질질 쌋습니다.  ","tjda****","2019.07.03 00:40",10
"769","10","역시 스파이더맨..♡♡  ","418k****","2019.07.03 00:31",10
"770","10","영상미, 스토리, 앞으로 마블영화 개연성 미쳤다!!! 제발 꼭 보세요. 믿고보는 스파이더맨임  ","정재현(gamo****)","2019.07.03 00:30",10
"771","10","아이언맨의 빈자리가 영화내내 느껴짐.. 토니의 바람대로 피터가 차세대 어벤져스를 잘 이끌어줬음 좋겠다  ","코쟁이(eomd****)","2019.07.03 00:30",10
"772","10","빌런을 떠나서 너무 흥미진진했고, 액션 또한 훌륭했습니다. 먼저 간 영웅들이 너무나도 생각났습니다.  ","깃털바람(lsm2****)","2019.07.03 00:29",10
"773","10","발랄한 미국 하이틴 영화에 간지나는 히어로물 얹은 느낌ㅋㅋㅋ 서툴고 인간미 넘치는 스파이더맨.. 너무귀여워♡  ","혜니(mola****)","2019.07.03 00:28",10
"774","10","너무 좋았다.. ㅠㅠ 아이언맨이 내 최애지만 스파이더맨 영웅으로 잘 성장해 나가길????  ","이은미(alsl****)","2019.07.03 00:27",10
"775","10","최고야 최고야 최고 ㅠㅠㅠㅠ  ","김예윤(kkub****)","2019.07.03 00:26",10
"776","10","마지막에 스파이더맨의 상징인 웹슈터망가졌을때 사물을 이용해서 해내는거 너무 진짜 아이언맨은 아이언맨보다 더 위대했다라고 말하는거 이해하게 하네요^^  ","cornel(pak2****)","2019.07.03 00:25",10
"777","10","영화가 코믹도 많고 액션이 엄청많아서 너무 재밌게 잘봤습니다! 추천드려요~~^^  ","jmjj****","2019.07.03 00:25",10
"778","10","진짜 너무너무 좋았던 영화였고요 이번에 굿즈템 많이 못사서 아깝네요 ㅜㅜ 진짜 꼭 보세요 진짜 안보면 후회합니다!! 영화중에 젤 기대작이고요????스파이더맨 사랑합니다 쿠키영상2개  ","박사랑(sara****)","2019.07.03 00:21",10
"779","10","믿고보는 마블~~역시 꿀잼ㅎㅎ  ","love****","2019.07.03 00:20",10
"780","10","재밌어요. 쿠키영상 반전!!액션신이나 스토리나 스파이더맨이랑 잘어울렸어요. 나도 아이언맨 보고싶다.  ","쑨이(jssw****)","2019.07.03 00:20",10
"781","10","토니의 스파이디사랑...??  ","퓨룽(cran****)","2019.07.03 00:20",10
"782","10","아이언맨이 스파이더맨을 알박기하다.소니, 가져갈테면 가져가봐!!  ","inhiura(miow****)","2019.07.03 00:19",10
"783","10","정말  쿠키영상보고 소름돋아서 입을 못 닫았다...  ","yubin1004(yubi****)","2019.07.03 00:18",10
"784","10","존잼 꿀잼 역시 실망시키지 않음  ","dhhfn(minj****)","2019.07.03 00:18",10
"785","10","재밋다! 10자를 쓰라고해서.  ","덕선이(douk****)","2019.07.03 00:17",10
"786","10","쿠키영상 무조건 보고 나오세요  ","김지수(dea0****)","2019.07.03 00:16",10
"787","9","기대보다 좋았던 작품. 다음편이 더욱 기대된다.  재밌다!  ","이경규(dlru****)","2019.07.03 00:15",9
"788","10","관람객찌리리리릿찌리리리리릿찌리리리리릿찌리리릴리ㅣㅅ  ","무송깜찍졸라멋져(anth****)","2019.07.03 00:12",10
"789","10","레츠 피터 찌리릿 ///  ","최지우(tig1****)","2019.07.03 00:11",10
"790","10","관람객개꿀잼입니다 계약 연장하길 스파이디 ㅠ  ","설덕주(digi****)","2019.07.03 00:11",10
"791","10","반전에  반전  쿠키영상  2개  역시  마블이군  ","newl****","2019.07.03 00:10",10
"792","10","토니의 흔적이 남아있는 영화  ","SeongJu(hajo****)","2019.07.03 00:08",10
"793","9","츠쿠요미다!! ㅋㅋㅋ  ","조성일(csi9****)","2019.07.03 00:08",9
"794","10","미쳤다 미쳤다 미쳤어 미쳤어 미쳤어 개미쳤어 쿠키영상 완전 제대로 미쳤어 하.... 진짜 3편 빨리 나와라 나 돌아버릴거같으니ㅠㅠ  ","정민주(uneh****)","2019.07.03 00:04",10
"795","8","관람객선배 어벤저에 대한 오마쥬들이 보기 좋았다.  ","오레오레(pang****)","2019.07.03 00:04",8
"796","10","쿠키영상 두개다 충격적이였다  ","wndu****","2019.07.03 00:03",10
"797","10","관람객두시간 후다닥지나감,,,,  ","붕어(hosu****)","2019.07.03 00:01",10
"798","9","관람객스타크가 파커를 쵸이스한 이유..아이언맨은 갔지만..어찌보면 아이언맨 챕터2 같고..엔드껨에서 끝난것같았지만 재부팅이였음ㅋ  ","BLACK(kkan****)","2019.07.03 00:00",9
"799","10","내가 메리제인이였음 좋겟다  ","YOUNG(khys****)","2019.07.03 00:00",10
"800","10","10자채워라재밌다.  ","여정(slim****)","2019.07.02 23:59",10
"801","10","쩔 오글거림쩔 그래서 너무좋았음  ","황진이(aouo****)","2019.07.02 23:58",10
"802","9","기대이상의 임팩트는 아니지만 다음 영화를 이어가기위한 추진력은 충분한 영화입니다. 어벤져스가 아닌 스파이더맨 다운 영화.  ","구름(ho97****)","2019.07.02 23:57",9
"803","9","다른 나라 비둘기들은 깨끗한가봄 비둘기가 팔에 올라간 상태에서 사진 찍을 때 충공깽. 설정 씨지 등 완벽한 영화는 아니었지만 잘 만든 영화라서 9점 줌.  ","스크랩(sisb****)","2019.07.02 23:55",9
"804","10","잼나...너무..말잇못..  ","하낭이(rlag****)","2019.07.02 23:55",10
"805","10","역대급 액션과 씨지임ㄷㄷ갠적으로는 의미를 떠나서 액션과 유쾌면으론 앤드게임 이상이었음  ","자몽이자뭉(ldw8****)","2019.07.02 23:54",10
"806","10","엠제이는 복받았고미스테리오는 피터찌리릿의 수련상대였다..  ","지혜(26jc****)","2019.07.02 23:53",10
"807","10","일단 홈커밍보다 재밌고 약간 지루한 감이 없지않아 있을수도 있는걸 유쾌하고 재밌고 신나게 만든데다가 지금 뿌린 떡밥들을 많이 회수하고 그 만큼의 떡밥을 뿌리고 끝납니다. 진짜 대박이었음. 스토리는 지렸거요  ","허세짱율무차(heoy****)","2019.07.02 23:51",10
"808","10","I love spiderman??  ","바이올렛(ga94****)","2019.07.02 23:49",10
"809","10","너무너무재밋어요최고임  ","수정공주(daya****)","2019.07.02 23:49",10
"810","10","피터 파커도 얼마나 토니 스타크를 사랑하는지, 그에 대한 책임감을 지려하는지 알 수 있게되는 영화ㅠㅠ♡  ","su20****","2019.07.02 23:49",10
"811","10","피터 찌리릿 존잼 생각이상 감동은 플러스.  ","hju(hju2****)","2019.07.02 23:48",10
"812","10","스포일러 당하기 전에 꼭 보러가세요!반전에 반전이 넘치는 영화ㅠㅠ 그냥 대박이에오..  ","동동이(dhy1****)","2019.07.02 23:47",10
"813","10","피터 파커 짱!!!♡♡♡  ","영재(acey****)","2019.07.02 23:45",10
"814","8","재밌는데 그냥 볼만한? 비교하긴 그렇지만 홈커밍보단 별루..  ","Hyeon(gus3****)","2019.07.02 23:45",8
"815","10","와... 기대 이상입니다. 두 번 보세요 여러분 아니 세 번 보세요..  ","sang****","2019.07.02 23:43",10
"816","10","스파이더맨의 성장기 ㅠ 그리고 반전 쿠키영상 두개 ㅜㅜㅜ  ","포스트잇(gy70****)","2019.07.02 23:40",10
"817","10","조금 유치했지만 그럼에도 정말 재밌었습니다  ","ACTDB(ahn6****)","2019.07.02 23:40",10
"818","10","역시 믿고보는 마블스튜디오ㅎㅎ  ","정홍구(love****)","2019.07.02 23:40",10
"819","10","처음부터 반전에 반전의 반전의 반전 ㅎㅎ 아이언맨 성장과정을 담은거 같았다 스파이더맨 흥해라 정말!!  ","슬라이스(vmfk****)","2019.07.02 23:38",10
"820","10","마블영화중에서 갠적으로 제일 좋았다!  ","lklk****","2019.07.02 23:37",10
"821","10","와~~~~ 돈이 안아깝다!!!!  ","시미(yh99****)","2019.07.02 23:36",10
"822","10","둘이 뽀뽀하는거 너무 귀엽잖아 ㅠㅠ  ","대동촌장(kwjg****)","2019.07.02 23:35",10
"823","10","쿠키영상은 ....^^그렇지만  역시마블...개꿀잼피터 너무귀엽다  ","Dingdong(ssky****)","2019.07.02 23:34",10
"824","10","역시 기대를 저버리지 않았습니다. 재밌었어요.  ","디군(sans****)","2019.07.02 23:27",10
"825","10","피터가 한층 더 성장하게 되는 영화다들 소름돋는 쿠키까지 다 보고 오세요 ..  ","서민지(seom****)","2019.07.02 23:26",10
"826","10","역시 액션은 마블 마블 마블  ","랑니(donk****)","2019.07.02 23:25",10
"827","10","재미있어요. 아기자기하면서 때로는 화려하구요.  ","사랑의종(elli****)","2019.07.02 23:25",10
"828","10","피터 찌리릿~!!!마블은 실망 시키지 않습니다~  ","door****","2019.07.02 23:24",10
"829","8","안경의 안경에의한 안경을 위한 영화!!드론으로 영상기술을 만들 줄이야!!!  ","씨뿌사(seed****)","2019.07.02 23:24",8
