"","score","review","writer","time","score_asnum"
"1743","7","여러모로 어설프다. (가짜라지만)어설픈 닉퓨리,어설픈 스파이디는 별 억지같은 이유로 만난지 몇시간안된 검증안된 신흥(가짜)히어로 미스테리오에게 안경을 넘긴다... 퓨리한테 반납하던가; mj를 좋아하게되는것도 뜬금없고 빌런과 후반 각성,액션빼면 별로였다  ","무크로상(sea0****)","2019.07.02 12:15",7
"1744","8","완벽한 마블식 성장 드라마. 그냥 생각없이 멋있고 짱쎈 빌런 나와서 우당탕탕 싸우는거 기대한 사람은 실망할수도 있음  ","123(djdo****)","2019.07.02 10:29",8
"1745","10","대체 모든 애들 다나오는 엔드게임이랑 왜 비교하는지 모르겠네.  ","오수용(budd****)","2019.07.02 10:28",10
"1746","10","엔드게임보다 재밌었다 역시 스파이더맨  ","enough(rdxs****)","2019.07.02 10:22",10
"1747","10","내가 본 마블 영화 중 탑 3에 듬  ","Embiid(neym****)","2019.07.02 10:18",10
"1748","6","알바 너무 많다 잘 거르자  ","오디(jop1****)","2019.07.02 10:07",6
"1749","8","그냥 8점정도인데 하이틴과 마블의만남  ","redm****","2019.07.02 10:06",8
"1750","6","아니 어떻게 악당을 만들 생각을 했을까? 토니스타크 보고싶다.  ","원영파파(dlaw****)","2019.07.02 09:37",6
"1751","10","관람객앤드게임후의  헛헛한 마음을 달래줄 영화  ","sk(ikak****)","2019.07.02 09:15",10
"1752","10","내 최애 스파이디 마지막 쿠키두개는 충격이다 진짜  ","sung****","2019.07.02 09:03",10
"1753","10","내가 본 스파이더맨 영화 중에 제일 이었다  ","김은성(free****)","2019.07.03 12:11",10
"1754","4","액션과 CG를 곁들여 김에 싸먹는기분  ","range(qjag****)","2019.07.03 00:29",4
"1755","2","마블 영화 보다 잠온건 처음..  ","원펀홍(rbgh****)","2019.07.02 23:06",2
"1756","5","도대체 언제 성숙한 스파이더맨이 될지... 가상현실액션이 짫았던건 큰실수.  ","현무아씨(gusa****)","2019.07.02 18:04",5
"1757","1","기대이상은 아니네요. 좀 지루합니다.  ","모든뜻(saye****)","2019.07.02 15:00",1
"1758","10","갠적으로 엔겜보다 훨씬 나음  ","parkhm(park****)","2019.07.02 10:17",10
"1759","10","역대급 스파이더맨 영화 ㅠㅠ  ","뷔뷔(ahri****)","2019.07.02 09:44",10
"1760","9","이렇게 인피니티 사가의 마지막장을 덮는군요.... 땡큐 마블!!  ","앙훈(s_sa****)","2019.07.02 09:40",9
"1761","1","톰홀랜드 스파이더맨은 1편부터 설계가 잘못됬다. 역경을 극복하는 주인공이아닌 기존에 인기절정의 아이언맨 등장 비중이 많고 또 맨날 도움받아 스스로 이겨내는 그림이 안나옴. Cg만 좋고 마블로고 달고나온 b급영화.  ","코큰형님(illu****)","2019.07.02 09:40",1
"1762","10","마지막 페이즈 정리 잘 했습니다. 앞으로도 좋은 영화 쭉쭉! 마블 화이팅...  ","NSHwriter(nsh0****)","2019.07.02 09:01",10
"1763","2","이게 도대체 뭐가 재밌냐유치하고약한영웅아이언맨이 눈을 너무 높여놨어  ","백호(jilk****)","2019.07.03 00:41",2
"1764","1","마블영화 돌려먹기 진짜 씹극혐.. 뻔한 스토리 개 노잼...  ","요염한탱자(pure****)","2019.07.02 14:06",1
"1765","6","초기 댓글들이라 마블 광팬분들이 댓글 다시다보니...평점들이 후한데 주관적으로 실망인 작품너무 많은걸 담으려다가 이도저도 아니게 되버림연출과 그래픽으로 때운 느낌마지막 쿠키2개가 이 영화에 끝이자 핵심신문사 사장님이 반갑더라  ","voya****","2019.07.02 11:40",6
"1766","6","마블 딱지없었으면 안봤을거같다.  ","winp****","2019.07.02 11:39",6
"1767","3","1편빨아님 쓰레기노잼 반박시 영알못  ","appl****","2019.07.02 11:16",3
"1768","1","마블이 점점 식상하고 재미없어지네요.  ","큐빅스(qubi****)","2019.07.02 09:54",1
"1769","10","집에 가면 부모님도 의심 해봐야겠다 ㅋㅋ  ","테즈얏(fhff****)","2019.07.02 09:19",10
"1770","1","관람객웃기지도 않고 재미도 없고 액션도 없음 두시간이 넘는 런타임동안 액션씬 15 분 채안나온듯 제작자도 찍는게 재미가없었는지 갑자기 각성함 돈주고 못볼 영화 액션씬을 제외한 나머지 시간이 오글거리고 답답하고 억지웃음 강요에 지쳐 빨리 끝났으면했음  ","jose****","2019.07.02 19:53",1
"1771","10","빌런 제조기 아이언맨....  ","왕복30분(wnrh****)","2019.07.02 10:02",10
"1772","1","솔직히 실망함...애들용..  ","잠탱s2(erlw****)","2019.07.02 09:38",1
"1773","10","아버지의 부재속 스스로 서는 소년.  ","바르샤와10년째(sman****)","2019.07.02 09:00",10
"1774","4","너무 유치한 히이틴 학원액션영화.이번건 마블작중 선에곱힐정도로 최악  ","빠꾸빠꾸(roll****)","2019.07.02 20:09",4
"1775","1","와 낚시 글들쩌네... 나만 발암이었나?ㅋㅋㅋ안보셨다구요? 꼭 보세요!그럼 다음편을 알아서 거르게 될겁니다 ㅋㅋ정치질은 현실에서만...  ","Soul(jise****)","2019.07.02 18:45",1
"1776","6","홀로그램 액션은 나름 신선했지만 스토리가 엉성했고 악당의 개연성 부족 그리고 학교친구들과 어울리는 스토리가 좀 지루했다  ","응응이(smsm****)","2019.07.02 09:01",6
"1777","5","이게 재밌다고??? 후.. 어제 심야로 보고왔는데ㅔ 진짜 너무 재미없었다. 나 원래 평점 높게주는 편인데 이건 아니다.  ","apu(apud****)","2019.07.02 09:05",5
"1778","1","절대 토비맥과이어의 스파이더맨을 넘을수 없다 그리고 이게 재밌다면 마블모든작품을 모욕하는것이다  ","마지막 기회(css9****)","2019.07.02 09:31",1
"1779","10","아이언맨을 위한 영화~~  ","닭(eyes****)","2019.07.03 14:06",10
"1780","10","피터스 트윙클!!!!  ","박군(hyoc****)","2019.07.03 14:05",10
"1781","10","EVEN DEAD, IM THE HERO.  ","8w8(mhja****)","2019.07.03 14:04",10
"1782","10","화장실에 거미한마리를 못잡겠다 스파이더우먼이 될 기회일까봐  ","귤맛커피(tayr****)","2019.07.03 14:03",10
"1783","10","개인적으로 역대급이었음  ","호놀룰루왕자(kywb****)","2019.07.03 13:58",10
"1784","10","역시마블스튜디오 눈물 서너번울뻔했네요ㅎ  ","디제이(shoo****)","2019.07.03 13:57",10
"1785","10","관람객10대의 피터 파커를 잘 표현한듯cg는 말할 것 없이 감탄했고  ","pppp****","2019.07.03 13:56",10
"1786","9","스파이더맨 시리즈 모두 봤는데, 이번 편 잘 만들었네요~ 반전있네요  ","Maranata(bigd****)","2019.07.03 13:54",9
"1787","10","진짜와 가짜 속에서 진실을 발견할 수 있는 놈들이 몇이나 되냐? 기술이 만들어내는 허상! 갈수록 현명함은 사라지고 지식만 남는 법!  ","에곤쉴레(afte****)","2019.07.03 13:54",10
"1788","10","토니 보는 눈 하나는 진짜 정확하다니까. 피터 사랑해  ","PILIT(kws0****)","2019.07.03 13:47",10
"1789","10","토니 스타크의 피터 파커사랑이 아름답다  ","최정윤(choi****)","2019.07.03 13:44",10
"1790","10","관람객재밋엇음 또보고싶다 다음편 언제나오냐  ","HSW(hsw2****)","2019.07.03 13:44",10
"1791","8","재미있음 ㅇㅇ 근데 엄청까진 아니고걍 시간때우기 좋은듯  ","찌질이(stab****)","2019.07.03 13:23",8
"1792","8","관람객시간가는줄 모르고 봤네요^^♡  ","la75****","2019.07.03 13:21",8
"1793","10","내가 이거보려고 마블영화 정주행해서 일주일간 다시봣었음..토니 스타크 보고 싶다 ㅠㅠ  ","악바리꼴통쉐프(rmag****)","2019.07.03 13:08",10
"1794","7","관람객돈내고 볼만은 한데 막 엄청 재미있진 않습니다영화 전반부보다 쿠키가 더 재밌었습니다  ","dang****","2019.07.03 12:58",7
"1795","6","관람객생각보다 가벼워서 조금당황했네요 미스테리오분 연기가멋졌던거같습니다  ","초릿조아(reds****)","2019.07.03 12:43",6
"1796","8","조조로 보고 왔는데 재밌네용 ㅋㅋ  ","Liberty(libe****)","2019.07.03 12:35",8
"1797","8","관람객데일리 뷰글 편집장님 19년째 승진못하시는중 ㅠㅠㅠㅠ  ","윤후명(kyho****)","2019.07.03 12:35",8
"1798","10","토니가 보고싶어지는 영화  ","뛰어난미모(sosa****)","2019.07.03 12:26",10
"1799","10","최고최고최고최고최고  ","뀨(sun9****)","2019.07.03 12:25",10
"1800","10","역대..최고의 영화드  ","수(soov****)","2019.07.03 12:01",10
"1801","10","영상미가 엄청 화려하고 멋짐!! 스파이더맨도 내가 좋아하는캐릭터라 굿굿!! 다만 조금유치하게 느낄수도있지만 화려한 영상미랑 풋풋한 스파이더맨의 사랑에 초점을봐서 재밌었음  ","가글가글(cjk1****)","2019.07.03 12:00",10
"1802","10","대박  피로회복제 마블영화 이번에는 더 재미남  ","베그(sork****)","2019.07.03 11:59",10
"1803","10","피터찌리릿 재밌었지만 쿠키영상보고 엄청 화났던 영화  ","jkl5****","2019.07.03 11:54",10
"1804","10","피터 찌리릿 귀엽잖앜ㅋㅋㅋㅋ  ","호랑이(mong****)","2019.07.03 11:53",10
"1805","10","믿고보는 마블, 해피는 귀엽고, 역시 토니의 눈은 틀리지않앗다  ","RR(craz****)","2019.07.03 11:53",10
"1806","10","관람객역시 마블은 항상 나에게 기대이상으로 만들어버린다구!  ","이름없는녀석(nona****)","2019.07.03 11:52",10
"1807","10","쿠키에서JK 시몬스 나올 때 소름돋음...  ","VEIDT(live****)","2019.07.03 11:46",10
"1808","10","역대 가장 충격적이었던 쿠키 영상 2개  ","sill****","2019.07.03 11:46",10
"1809","10","관람객최고에욜역시스파이더맨  ","김병철(adh8****)","2019.07.03 11:44",10
"1810","10","재미있게 봤어요~~~  ","혼밥백선생(dlru****)","2019.07.03 11:44",10
"1811","10","관람객정말 재밌게 봤습니다. 강추합니다!!  ","gkeh****","2019.07.03 11:39",10
"1812","9","홈커밍의 감동은 없지만 더 화려하고 더 웃겼다.  ","qmff****","2019.07.03 11:38",9
"1813","9","관람객진짜 재밌게 봤습니다!  ","TheReds25(25km****)","2019.07.03 11:38",9
"1814","10","연출,영상 역대급!!  ","vn_n****","2019.07.03 11:33",10
"1815","8","관람객재밌는데 짧아서 아쉽 ㅜㅜㅜㅠ  ","pw56****","2019.07.03 11:31",8
"1816","10","확실친 않지만 톰 홀랜드가 총 9편의 단독영화를 계약했다는 말이 있는 거 보니 베놈과 크로스오버한다는 것도 가능하겠네 ..  ","jhjo****","2019.07.03 11:30",10
"1817","10","스파이더맨: 파 프롬 드론  ","김토미(rlax****)","2019.07.03 11:29",10
"1818","10","스파이더맨: 파 프롬 드론  ","김토미(rlax****)","2019.07.03 11:29",10
"1819","10","연출과 스토리가 기가 막히네 쿠키영상까지 완벽한 두시간 이였다  ","베스티유지(park****)","2019.07.03 11:29",10
"1820","10","토니스타크 아이언맨 나오지않아도 꽉 찬 존재감ㅠ스파이더맨과 같이 그리워 눈물났음ㅠ 이제 토니가 없는 스파이더맨의 성장기와 볼거리 늘 실망시키지 않는 믿보마블  ","하얀눈(auro****)","2019.07.03 11:27",10
"1821","10","아이언맨을 차세대로 넘겨주는 영화  ","시험시러(rhtm****)","2019.07.03 11:25",10
"1822","10","역대 스파이더맨 시리즈중 최고의 영화, 이 영화는 미쳤습니다. 구성 연출 연기력 모두 최고입니다. 특히 쿠키영상 보고  전율이 돋았습니다. 그냥 미친영화. 제이크 질렌할 역대 최고의 캐릭터 박수를 보냅니다  ","모피어스(upup****)","2019.07.03 11:20",10
"1823","9","관람객마블의 새로운 시대를 시작하는 영화라는데... 그냥 마블스러웠다.  ","유무(ysyz****)","2019.07.03 11:19",9
"1824","10","너무 재밌었어요 ㅎㅎ 다음 편 빨리 나오면 좋겠습니다!!  ","제논조아(gree****)","2019.07.03 11:17",10
"1825","8","시간 보내기 좋습니다 ..  ","판타지(nemo****)","2019.07.03 11:15",8
"1826","8","유두버들 임마들아~ 멀티버스같은 소리하고 있네..  ","상구엄마(youd****)","2019.07.03 10:09",8
"1827","9","쿠키까지 꼭!  챙겨봐야~  ","잿빛비상(gray****)","2019.07.03 09:51",9
"1828","9","제이크 질렌할은 나이트크롤러. 옥자에 이어 여기서도 티비쇼에 미쳐 날뛰는군  ","hdr3****","2019.07.03 09:50",9
"1829","9","관람객쿠키영상 두개 다 보세요  ","이승규(ange****)","2019.07.03 09:39",9
"1830","10","1편보다 재밌음 쿠키굿  ","의대(dmle****)","2019.07.03 09:30",10
"1831","10","관람객스파이더맨 만의 분위기가 있어요 보는 내내 기분좋고 행복했고 재미있었습니다!  ","minsun82(qkdw****)","2019.07.03 09:29",10
"1832","10","재미있어요시간이 후딱또  볼의향있음강추  ","chor****","2019.07.03 09:29",10
"1833","8","특별출연 : 백승호....  ","이상철(lees****)","2019.07.03 09:25",8
"1834","10","관람객피터 찌리릿 ㅋㅋㅋㅋ 피터 귀여워요  ","갓정미(sexy****)","2019.07.03 09:22",10
"1835","10","개인적으로 스파이더맨은 토비 그런데 톰홀랜드도 그다음으로 잘 어울린다  ","4715****","2019.07.03 09:22",10
"1836","10","관람객이제 두번만 더보면 되겠다  ","라온맘(cool****)","2019.07.03 09:20",10
"1837","10","관람객개인적으로 마블영화 중 최고  ","wk25(swk0****)","2019.07.03 09:17",10
"1838","10","미스테리오를 풀어가는 각본의 영리함에 놀라고기대 이상으로 찰진 액션에 취한다.  ","소중한별봄(kili****)","2019.07.03 09:16",10
"1839","10","관람객욕시 잼나유 ㅎㅎ 담편도 빨리 나왔으면  ","허두왕님(cky4****)","2019.07.03 09:01",10
"1840","10","개인적으로 토비의 스파이더맨도 2가 재밌었은데 이번편도 2가더 재밌네..  ","뚱이(dkfo****)","2019.07.03 09:00",10
"1841","10","관람객진짜 최고였어여ㅋㅋㅋ친절한 이웃에서 한걸음 더!!  ","후비안닥덕후(kore****)","2019.07.03 08:59",10
"1842","10","관람객넘 잼께 봤어요 !!허허  ","호호호(4959****)","2019.07.03 08:57",10
"1843","10","관람객역시 마블이란말밖에 안나온다 최고의 스파이더맨영화  ","reds****","2019.07.03 08:54",10
"1844","10","두시간이 호다닥!!!  ","스포달(ayy1****)","2019.07.03 08:52",10
"1845","9","관람객다음화가 기대되네요~  ","ppul(bear****)","2019.07.03 08:50",9
"1846","10","피러파커 ㅠㅠㅠ 성장통 영화. 넘 재밌었어요~  ","성희펭(park****)","2019.07.03 08:50",10
"1847","10","쿠키영상 두개 다 보세요  ","행복(0130****)","2019.07.03 08:48",10
"1848","10","반전의 반전이 거듭되는 찌리릿한 영화입니다  ","캐니언(chs2****)","2019.07.03 08:45",10
"1849","10","Peter tingle !!!  ","qkrt****","2019.07.03 08:43",10
"1850","10","관람객너무 재밌음. 쿠키 영상 2개  ","피자(fah2****)","2019.07.03 08:42",10
"1851","10","꿀잼이다ㅎㅡㅎ 꼭 보세요  ","kyun****","2019.07.03 08:40",10
"1852","10","하...아이언맨이 빠진 어벤져스의 문제점을 정확히 드러낸 영화였고, 피터파커가 세상을 구한 영웅이지만 아직은 미성숙한 10대라는걸 제대로 표현한 영화였다, 성장스토리도 완-벽,  ","thdg****","2019.07.03 08:39",10
"1853","10","홈커밍보다 액션씬도 많아져서 좋다 톰홀랜드 연기 너무 잘하고 귀여움♡  ","자몽(qlrq****)","2019.07.03 08:39",10
"1854","10","관람객스파이디 사랑해 ㅜㅜ 3도 기다릴게  ","상상본드(csm0****)","2019.07.03 08:38",10
"1855","10","마지막 전투씬이 좋았습니다.  ","엘리(sent****)","2019.07.03 08:38",10
"1856","10","영상미가 좋으며 시리즈중 액션씬이 제일 나음  ","조두한(blue****)","2019.07.03 08:26",10
"1857","8","관람객뻔했지만 뻔하지만은 않았던 이야기  ","Figurenix(kdhk****)","2019.07.03 08:25",8
"1858","8","관람객여전히 귀엽고 아기자기한데 훨씬 더 똑똑해지기까지  ","slim****","2019.07.03 08:24",8
"1859","10","재밌게봤어요 유쾌한영화~  ","김동현소장(kkmj****)","2019.07.03 08:23",10
"1860","10","관람객스파이더맨 팬이라면 이유불문 꼭 보세요!  ","과니(kimb****)","2019.07.03 08:21",10
"1861","10","와우 역시 마블은 마블이다  ","순초리(ksc3****)","2019.07.03 08:12",10
"1862","10","""기생충""이 초인종 부분부터 장르가 바꼈다면,""파프롬홈""은 mj의 밀행으로 장르가 바뀐다.식스센스급 반전 영화인듯 ㅋㅋ  ","a성투z화이트샤크(necr****)","2019.07.03 08:10",10
"1863","10","찐짜찐짜 재밌다 시간순삭스  ","이성민(dltj****)","2019.07.03 08:09",10
"1864","9","마블과  또  찌리릿 해버렸다... 역시 마블 그리고  스파이더맨  ","순수소년(otu2****)","2019.07.03 08:06",9
"1865","9","영웅은 만들어지는것 피터의 성장기  ","mylo****","2019.07.03 07:58",9
"1866","8","관람객깊게 생각하지말고 보세요  ","악귀(bhsb****)","2019.07.03 05:27",8
"1867","10","관람객마블은 진리다. 쿠키영상 2개굿  ","뚝심TV(ttuk****)","2019.07.03 04:37",10
"1868","10","스파이더맨의 새로운 전설  ","김영감님(ky10****)","2019.07.03 03:57",10
"1869","10","피터! 넌 잘 할것이야!!그나저나 아이언맨 아니 토니 스타크가 보고 싶다!  ","rook****","2019.07.03 03:46",10
"1870","10","한줄요약 : 멀티버스는 훼이크다 이새끼들아  ","놀고먹고싶어요(zbpe****)","2019.07.03 03:34",10
"1871","10","토니의 뒤를 잇기에 부족함이 없는 우리의 다정한 이웃 ~~~ 개인적으로 마블 모든 솔로무비중 가장 재밌었다  ","운똥(dnst****)","2019.07.03 03:29",10
"1872","10","너무너무너무너무너무너무너무 잼쓰  ","kpj(ekdt****)","2019.07.03 03:16",10
"1873","10","큰스크린에서 봐야 재미있어요. 새로운컨셉으로 접근해서 신선했어요. 재미있었어요  ","star****","2019.07.03 03:11",10
"1874","10","관람객와 진짜 너무너무 재미있었어요!!!! 처음부터 끝까지.. 끝날때까지 끝난게 아닌 장면들도 좋았습니다!!!!  ","Rechal(mynr****)","2019.07.03 03:06",10
"1875","10","기대하고봐도 재미있다  ","윤태웅(ytw0****)","2019.07.03 03:04",10
"1876","10","피터가 울면 같이 울고 웃으면 같이 웃게되던 영화, 번역도 너무 좋았고 통수를 오지게 맞아서 다보고나니 뒷통수에 구멍이 날 지경. 후속작은 커녕 다음 마블영화 10개월 뒤에 나오는게 이렇게 슬플수가 없음오늘보고 아직도 뒷얘기 궁금해서 다른걸 못하겠다  ","오예(ekgo****)","2019.07.03 03:03",10
"1877","10","바로 내일 또 볼거에요...기대 안하고 보다가 엄마미소 지으면서 몰입되네요  ","장미래(mras****)","2019.07.03 03:02",10
"1878","10","처음부터 쿠키까지 너무 재밌잖아..  ","기타(kita****)","2019.07.03 03:00",10
"1879","10","토니 여전히 3000만틈 사랑해  ","허재은(hjo9****)","2019.07.03 02:58",10
"1880","10","재밌게 잘봤어요 역시 멀티버스!  ","라희맘남편(3d09****)","2019.07.03 02:47",10
"1881","10","관람객엔드게임이 끝나고 나온거라 큰기대 안했는데,진짜 재밌었다..하..미쳤다..스포하고싶어진다ㅋㅋ마블 좋아하시는분들 꼭 보세요!!!!ㅋㅋ참고! 쿠키2개입니다  ","tkdghd741 카카오톡(tkdg****)","2019.07.03 02:33",10
"1882","10","관람객진심 미쳤다 레알로다가  ","Sunnydayz(jaew****)","2019.07.03 02:30",10
"1883","10","기대만큼 재밌던 영화 앞으로가 더 기대되는 스파이더맨 톰홀랜드!!!  ","dayo****","2019.07.03 02:29",10
"1884","8","나아가자 앞으로 !  앞으로의 새로운 세대로의 도약  ","youryoung(kdy4****)","2019.07.03 02:26",8
"1885","10","마지막 쿠키영상 생각했던거랑 완전 다름...  ","아미(yoon****)","2019.07.03 02:26",10
"1886","10","평점, 후기보고 볼지 안볼지 선택하고 계시는분들  그냥 지금 예매하시져?  ","귤(gjsl****)","2019.07.03 02:24",10
"1887","10","관람객기대 그 이상! 꼭 보세요~  ","뱅뱅(gbh7****)","2019.07.03 02:23",10
"1888","8","관람객액션은 엔드게임보다 더 박진감 넘치는 부분이 많아서 아주만족, 다만 러닝타임을 의식한 다소 급한 전개와 허술한 각본이 아쉽다  ","스크랩헤븐(rty7****)","2019.07.03 02:21",8
"1889","10","최고예요!정말~ 스파이더맨중가장역대급인듯진짜잘어울려요  ","Anastasia(jena****)","2019.07.03 02:20",10
"1890","10","내가 김안경잽이다 안경의 주인은 바로 윌리다!!!  ","밀짚모자피즈(game****)","2019.07.03 02:18",10
"1891","9","너는 수트를 맡아 나는 음악을 맡을게  ","앤썸(pkh0****)","2019.07.03 02:17",9
"1892","10","발암...이 오는듯 했으나 뭐 나름 나쁘지않은 진행과 결말?  ","서비(khs1****)","2019.07.03 02:14",10
"1893","10","쿠키영상기달리다가 OO뻔했다  ","한동성(ehdt****)","2019.07.03 02:12",10
"1894","9","확실한건 전편보다 낫네 전편에 내 눈이 이상하고 유치하게 느껴진게 아니었어 그냥 영화를 ㅈ같이 만든거였어  ","벌레(rnjs****)","2019.07.03 02:12",9
"1895","10","관람객영상미최고오~ㄴㅇㄹ  ","박홍일(park****)","2019.07.03 02:12",10
"1896","10","스파이더맨! 무슨말이 더 필요한가  ","jueh****","2019.07.03 02:12",10
"1897","10","진짜.,.ㅠㅠㅠ흑흑 새로워 짜릿해!!!  ","김종인(mese****)","2019.07.03 02:09",10
"1898","10","너무 재밌다ㅜㅜ 너무너무 재밌다ㅠㅠㅠ 재밌다 재밌어ㅠㅠㅠㅠ 영화는 마블... 마블,,당신들,,,최고...  ","chbi****","2019.07.03 02:09",10
"1899","10","존잼 ㅠ 오랜만에 몰입해서 본 영화  ","예수(insi****)","2019.07.03 02:08",10
"1900","8","킬 커맨드 : 드론의 습격  ","거누(lki9****)","2019.07.03 02:08",8
"1901","10","구웅운욷웆욱웁위웆웃  ","luke(0131****)","2019.07.03 02:07",10
"1902","8","관람객다소 아쉽지만 매우 흥미진진  ","구와라아악(davi****)","2019.07.03 02:04",8
"1903","8","기대가 너무 컸던 탓일까  ","skad****","2019.07.03 02:03",8
"1904","8","참신한 영화 설정은 너무 좋았다.  ","meri****","2019.07.03 02:02",8
"1905","10","기대안하고 봤는데 흥분하며 나왔어요  ","사악(vlfq****)","2019.07.03 01:59",10
"1906","10","오늘 스파이더맨개봉하는지도몰랐는데..아줌마들이 예매해서 같이봤다.  돈이안아깝드라.너무재미나게봤다.신랑하고 두딸하고 가라고 추천할정도다. 개인적으론 완전 강추!  ","십사문주(lady****)","2019.07.03 01:59",10
"1907","10","영화시작부터 뭉클하고 피터의성장영화 보는기분 빌런기술도 굿  ","bonsweet(hyod****)","2019.07.03 01:59",10
"1908","10","4D로 보세요 4번 보세요.  ","kkys****","2019.07.03 01:56",10
"1909","10","번역은 쿠키 영상까지 완벽했다  ","오경록(kyeo****)","2019.07.03 01:55",10
"1910","10","피터 ㅉ ㅣ 리 릿!!ㅎㅎ!!!!  ","jamie(0lam****)","2019.07.03 01:54",10
"1911","6","스파이더맨재밋네 ㅇㅅㅅ  ","nike****","2019.07.03 01:54",6
"1912","10","너무 재미있어요 역시 마블 스파이더맨 연기 너무 잘했어요  ","행복썬(jj14****)","2019.07.03 01:53",10
"1913","8","빵빵 계속 터지네. 아는 만큼 보인다는데 원작에 대한 내용에 대해 모르고 가는게 더 재밌을듯.  ","사랑사랑사랑사랑(kckz****)","2019.07.03 01:52",8
"1914","10","역대 마블 영화 중 최고다  ","asdf(demo****)","2019.07.03 01:50",10
"1915","10","페이즈3의 직접적인 마무리와 쿠키영상으로인한  페이즈4의 거대한 시작의 종을 알리네요.  ","크로버(clov****)","2019.07.03 01:49",10
"1916","8","아이언맨을 그리워하고 추모하는영화  ","겸짱마이쮸(0000****)","2019.07.03 01:49",8
"1917","10","세대교체의 신호탄을 쏜것 같은 영화! 영화가 진행될수록 몰입도가 점점 올라서 재밌게 봤습니다!  ","오리지널포카칩(wld1****)","2019.07.03 01:49",10
"1918","10","액션 진짜 모든 스파이더맨 영화 중에서 제일 최고였던것같습니다!! 존잼!!  ","이성구(tjdr****)","2019.07.03 01:47",10
"1919","10","닉퓨리-탈로스 켈러 아이엠 그루트  ","용구(kyk_****)","2019.07.03 01:45",10
"1920","10","한줄평- 스파이더맨 잘생겼다 ㅎㅎ  ","조예은(aall****)","2019.07.03 01:45",10
"1921","10","진짜 레전드임 꼭 보셈 역대급 스파이더맨  ","김동현(blac****)","2019.07.03 01:43",10
"1922","10","충격충격충격충격충격  ","noosa66(kies****)","2019.07.03 01:42",10
"1923","10","관람객저도 레드제플린 좋아해요  ","나비(yuzu****)","2019.07.03 01:42",10
"1924","10","홈커밍과 비교해서 모든게 한차원 발전된 이야기 연기 전개와 액션씬 등과 토니 스타크에대한 그리움과 피터의 역경을 딛는과정, 그속에서도 잊지 않는 10대의 풋풋한 고민과 이야기가 잘 녹아들어서 종합선물세트 같은 영화였음!  ","cynical(dhwl****)","2019.07.03 01:41",10
"1925","10","관람객피터 파커가 슈트 설정들을 할 때 대사는 없었지만 해피의 눈은 ‘토니.. 이젠 편히 쉬어도 되겠어..’라고 말했다  ","momamoo(fres****)","2019.07.03 01:39",10
"1926","10","멋진 썬글라스 더 멋진 스파이더맨~^^사랑스런 영국 남자~^^  ","밑도 끝도 없이(hyun****)","2019.07.03 01:36",10
"1927","10","관람객두번봐도 후회없어용 강추!  ","박예담(sam1****)","2019.07.03 01:34",10
