"","score","review","writer","time","score_asnum"
"1205","8","쿠키 영상 무조건 보세요!!  ","몽환(wkdd****)","2019.07.02 15:13",8
"1206","10","방금봤는데   또  보고싶다     ㅜㅜ  ","에어캐나다(kjh6****)","2019.07.02 15:11",10
"1207","10","토니형 보고싶어요..ㅜ 다시나와줘요  ","인생막살아요(akk1****)","2019.07.02 15:11",10
"1208","10","피터파커 대박 wtf 3000만큼 사랑해 ㅎ  ","SOULHOONI(indr****)","2019.07.02 15:10",10
"1209","10","찌릿함을 넘어 짜릿한 영화  ","hns1****","2019.07.02 15:09",10
"1210","10","피터 찌리릿이 한 건 했네  ","지니(snai****)","2019.07.02 15:06",10
"1211","10","마블 영화는 언제나 즐겁다  ","ROTO(dlsh****)","2019.07.02 15:04",10
"1212","9","존잼ㅠㅠ 톰 홀랜드 그동안 매력있는 스파이더맨이라고 생각 안했는데 이번 편에서 그 생각이 틀렸다는 걸 알았다  ","asdfl(thsw****)","2019.07.02 15:03",9
"1213","10","죽은토니가 산 타노스를 골탕 먹이는 영화  ","Tigers V11(tige****)","2019.07.02 15:02",10
"1214","10","그냥 최고다ㅠㅠ 토니스타크의 흔적들이 보이고 피터파커가 조금 더 성장하게 되는 영화인데 쿠키영상은 진짜 개 충격. 우리 피터 꽃길 언제 걷니...?  ","rladmswl(rlad****)","2019.07.02 15:01",10
"1215","10","레드재플린으로 이어지는 넥스트 아이언맨  ","아이리스(kaos****)","2019.07.02 15:01",10
"1216","10","반전매력 너무너무 재밌네요 ㅎ  ","jknd****","2019.07.02 15:00",10
"1217","10","보는내내 토니스타크가 피터를 얼마나 생각하고 사랑하는지 알게해준 영화.  ","사이세이(nwh0****)","2019.07.02 15:00",10
"1218","9","재밌었다 액션씬도 후반에 많이 나와서 볼만하고 그래도 홈커밍이 뭔가 보고나서 만족감은 더 컸던거 같다  ","킬리퀸(tekk****)","2019.07.02 14:59",9
"1219","10","그냥 정말 빠져들었어요 ㅠㅠ 오랜만에 영화다운 영화를 봤네요 ㅠㅠㅠ!!!  ","변수민(ro45****)","2019.07.02 14:57",10
"1220","10","토니스타크를 다시한번 생각 하게 해주는 영화  ","윤찬혁(yunc****)","2019.07.02 14:57",10
"1221","10","쿠키영상 두개 다보고오세영~  ","wlgh****","2019.07.02 14:55",10
"1222","10","꿀잼 허니잼 존잼 딸기잼  ","CN(qkrg****)","2019.07.02 14:55",10
"1223","10","실패없는 마블 마블마블마물  ","별시착(appo****)","2019.07.02 14:54",10
"1224","10","잼있어요~ 쿠키2개 다 보셔요~  ","inst****","2019.07.02 14:51",10
"1225","10","관람객오~~ 완전 예상하지못한 반전이었네요 중간중간에 재미도 있고 정말 오랜만에 재밌게봤어요  ","알럽(sohu****)","2019.07.02 14:51",10
"1226","10","본편도 재밌지만 쿠키 영상 두개가 훨씬 더 재밌다. 설마 그 분과 그 분들이 나올 줄이야...  ","한빈(edod****)","2019.07.02 14:49",10
"1227","10","스토리 재밌었고 액션씬 엄청 화려함  ","웅늉(sgg4****)","2019.07.02 14:42",10
"1228","10","코믹스 원작에서 불운의 아이콘 스파이더맨을 보여주려는 마블의 큰그림  ","물방울(ho12****)","2019.07.02 14:38",10
"1229","10","아이언맨이 더 그리워지는 영화  ","SONIC(saki****)","2019.07.02 14:38",10
"1230","10","진짜 오랜만에 영화봤는 데 내가 갇혀있었던 이 삶에 산뜻한 바람을 불어넣어줬다. 사막에 강물이 들어간 것처럼, 이 영화는 모든 게 완벽한 영화였다.  ","dydy****","2019.07.02 14:38",10
"1231","10","꿀잼이요 쿠키 두개다 꼭보세요  ","콜드브루(leon****)","2019.07.02 14:37",10
"1232","10","스파이더맨 파 프롬 홈에 오신 것을 '환영' 합니다 :)  ","별명입력(gka5****)","2019.07.02 14:36",10
"1233","6","애들버전 청춘영화 착하면 이용당하고 배신에 통수 당한다는걸 교훈삼는 영화  ","애리앤(apla****)","2019.07.02 14:35",6
"1234","10","오리지널 스파이더맨 팬도 마블 스파이더맨 팬도 모두 만족시키는 영화!!! 역대 스파이더맨들의 매력만 모아놓은것 같은 톰 홀랜드도 칭찬해~!! 영화를 한줄로 얘기하자면 '거짓말이야~ 거짓말이야~ 거짓말이야~'  ","g981****","2019.07.02 14:35",10
"1235","10","관람객역대급 스케일에 재미도있고 반전도 있고 완벽해~~!!  ","박은지(glwl****)","2019.07.02 14:35",10
"1236","10","영화가 끝나는 순간 내몸도 찌리릿...  ","이정현(only****)","2019.07.02 14:35",10
"1237","10","스파이더맨 said what the fu..  ","최우진(wooj****)","2019.07.02 14:34",10
"1238","10","스파이더맨은 사랑입니다  ","hotboy(hong****)","2019.07.02 14:32",10
"1239","9","와...반전의 반전의 반전 쿠키2개는 꼭보고 나와야함.  ","HuBi(mmha****)","2019.07.02 14:31",9
"1240","9","홈커밍에서 못 보여준 액숀을 여따 다 쏟아넣음. 역대급의 역대급의 역대급 액션  ","wjdg****","2019.07.02 14:30",9
"1241","10","관람객재밌었어요! 토니스타크 멋있어ㅜㅜ  ","nada(miok****)","2019.07.02 14:28",10
"1242","10","스포당할까봐 퇴근하자마자 조조로 봤는데 좋은 선택이었다  ","JYL(wint****)","2019.07.02 14:28",10
"1243","10","다시 봐야겠음.. 닉퓨리가 크리 어쩌구 했는데 기억이 안나넹 ㅠ  ","eych****","2019.07.02 14:27",10
"1244","10","Goody good. I love it!  ","김상윤(daes****)","2019.07.02 14:26",10
"1245","8","토니의 빈자리ㅠㅠㅠㅠ 피터랑 함께 느낌ㅠㅠ...이디스  ","Bonnie(jsry****)","2019.07.02 14:20",8
"1246","10","포스터가 좀 그렇다.. 영화는 꿀잼  ","김정환(inth****)","2019.07.02 14:18",10
"1247","10","even dead i'm the hero  ","김혁진(suro****)","2019.07.02 14:18",10
"1248","10","피터 찌릿찌릿!!!!  ","스타매니아(simf****)","2019.07.02 14:14",10
"1249","10","마지막 눈감고 스파이더센서만으로 싸우는장면은 역대급  ","neo1****","2019.07.02 14:13",10
"1250","6","재밌네요 그렇다구요 ..  ","dndb****","2019.07.02 14:12",6
"1251","10","아이언맨은 로다주, 스파이더맨은 톰홀랜드.오늘부터 내 최애 캐릭터는 톰홀랜드의 스파이더맨.  ","perw****","2019.07.02 14:12",10
"1252","10","재밋습니다요~^^^  ","bece****","2019.07.02 14:12",10
"1253","10","보는내내 몰입하고 봤어요 진짜 재밌었음..  ","귤랭이(jiho****)","2019.07.02 14:12",10
"1254","10","롤러코스트 타는 기분. 내용도 좋고 눈이 즐거운 잘 짜여진 영화  ","여름날의 미풍(ssss****)","2019.07.02 14:11",10
"1255","8","묻지도 따지지도 말고 바로 이거거든  ","hws6****","2019.07.02 14:09",8
"1256","10","페이즈4 관한 내용은 1도 안나오니 기대하고가지마세요  ","dogjook(dogj****)","2019.07.02 14:07",10
"1257","10","분명 스파이더맨영화인디 토니 얘기가 더많넹 ㅋㅋ스파이더맨영화야 아이언맨영화야 ㅋㅋㅋ  ","rhen05(rhen****)","2019.07.02 14:03",10
"1258","8","여기서 당장나가!!온갖스포들이 난무하고있어!  ","룡이Tv(rlax****)","2019.07.02 13:59",8
"1259","7","하이틴영화 한 편을 본 느낌입니다. 유쾌하지만 너무 가볍고, 미스테리오의 제이크 질렌할의 연기는 좋았지만, 빌런 캐릭터 자체가 매력이 없다는 ㅜㅜ 마블영화는 의리로 보지만, 평점 7점 수준의 영화. 시간나면 보고, 시간 내서 보면 아쉬울수도 있다는!  ","최원(siwo****)","2019.07.02 13:59",7
"1260","10","Peter tingle??  ","박정윤(pra1****)","2019.07.02 13:51",10
"1261","10","한줄평: 마블 미쳤냐?...  ","wwwe****","2019.07.02 13:51",10
"1262","10","믿고보는 마블. . .  ","큰사랑기프트(bigl****)","2019.07.02 13:51",10
"1263","9","보이스 피싱 신고는 경찰청 (신고전화 112) 또는 경찰청 사이버안전국으로 해주세요.  ","낙발(ssnh****)","2019.07.02 13:50",9
"1264","7","관람객드론이랑 싸우기 바쁜 스파이더맨  ","이홍은(lhe7****)","2019.07.02 13:50",7
"1265","10","다 볼만 했는데 피터파커가 언제부터 MJ를 저렇게나 좋아했는지가 계속 의문이라 내가 혹시 전편 안봤나? 싶을정도 였음. 감정몰입이 좀 힘들었을정도. 그러나 그것 빼고는 진짜 CG효과는 마블 탑급  ","가짱(ga_z****)","2019.07.02 13:49",10
"1266","9","관람객대체적으로 다 만족할만한영화 단 핑거스냅사태를 너무 가볍게 흘려버린거같아서 조금은 아쉬운점이 있다..  ","DkEoSw(euhh****)","2019.07.02 13:49",9
"1267","10","영화 중간에 살짝 충격 받고 쿠키에 맛이 가는 영화.  ","공유내꺼(sodm****)","2019.07.02 13:49",10
"1268","10","관람객전작보다 화려해진 액션에서 놀라고 쿠키에서 더 놀라고  ","PH(upir****)","2019.07.02 13:47",10
"1269","10","말이 필요한가?마블인데  ","폴유(love****)","2019.07.02 13:47",10
"1270","10","첫째쿠키보고 헉!둘째쿠키보고 앗!  ","취객(juny****)","2019.07.02 13:47",10
"1271","10","닉퓨리는 캡틴마블이후로 왜케 호구에다가 개그캐릭터로 변한건지 ㅋㅋㅋㅋ  ","박정민(cdrp****)","2019.07.02 13:47",10
"1272","8","큰일이네 인피니티워 이후에 정점찍고 내려온 느낌이네 나에게는  ","수려한신(more****)","2019.07.02 13:46",8
"1273","9","쿠기영상 보기위해 마지막까지 자리에 남아있었습나다.  ","박아람(ddod****)","2019.07.02 13:46",9
"1274","10","피터 파커 '3000만큼 사랑해'  -토니스타크-  ","TSF(khjy****)","2019.07.02 13:44",10
"1275","10","진짜 너무재밌음 너무너무재밌음  ","소사동가디언(qorw****)","2019.07.02 13:43",10
"1276","10","쿠키영상꼭봐라.  피터파커  ","이경석(fhdl****)","2019.07.02 13:42",10
"1277","10","진짜 재밌다.그냥 보세요.  ","버거씨(tjdr****)","2019.07.02 13:42",10
"1278","8","관람객재미있어요시간 가는줄 몰랐네요  ","leh5****","2019.07.02 13:41",8
"1279","10","마블이 현재진행형이라는 증거인 작품ㅋㅋㅋ  ","nuri****","2019.07.02 13:41",10
"1280","8","토니 3000만큼 보고싶어...  ","snowbin(tjfd****)","2019.07.02 13:39",8
"1281","10","쿠키영상들이 영화본편보다 더 쇼킹하네  ","beck****","2019.07.02 13:39",10
"1282","10","관람객만족할만한 후속작임 돈안아까움ㅋ  ","아실란(epql****)","2019.07.02 13:39",10
"1283","10","체고다! 스파이더맨!!  ","ekekek(flsh****)","2019.07.02 13:39",10
"1284","10","너무 잼났어요~ 쿠키영상이 두개라니 ㅠㅠ 하나보고 나왔단말입니다 ㅠㅠ  ","진콩(2254****)","2019.07.02 13:37",10
"1285","10","관람객엄준식엄준식엄준식엄준식  ","이상재(dltk****)","2019.07.02 13:37",10
"1286","10","그냥 마블이 영화를 잘만드네  ","카카팬(tooy****)","2019.07.02 13:36",10
"1287","10","쿠키미쳤다..그래서 후속작은 언제라구요?ㅠㅠ  ","옐미(kasd****)","2019.07.02 13:36",10
"1288","10","너무 재밌는데 마음아파..ㅜㅜ 토니..  ","온유(mipi****)","2019.07.02 13:31",10
"1289","10","관람객위트와 감동이 있다.  드디어 등장한 J편집장, 그의 활약을 괄목하라  ","김세중(qsj1****)","2019.07.02 13:31",10
"1290","10","관람객재미있게 잘 봤습니다. 개인적으로 베놈과의 어떤 연결점이 있지 않을까 기대하면서 봤는데 ㅜㅜ  ","Dark Knight(jjw1****)","2019.07.02 13:30",10
"1291","9","평식이형이 어떻게 글 쓸지 궁금해 진다 ㅋㅋ  ","arar****","2019.07.02 13:30",9
"1292","10","톰홀랜드ㅠㅠㅠㅠ기대된다아  ","엘(danz****)","2019.07.02 13:29",10
"1293","10","아 ㅅㅂ 방금 보고나왔는데 쿠키가 2개라니..  ","고인물(baby****)","2019.07.02 13:29",10
"1294","10","토니스타크 아이언맨이 생각낫던 영화인거 같다.  ","레디엘리(tldi****)","2019.07.02 13:28",10
"1295","10","떡밥장난이심하다ㅠㅠ  ","구해줘2(dadd****)","2019.07.02 13:28",10
"1296","10","재미있음!! 적절한 액션, CG, 개그요소와 로맨스까지  ","wldd****","2019.07.02 13:27",10
"1297","6","벌써부터 토니 스타크가 그립다  ","요한슨(yokk****)","2019.07.02 13:26",6
"1298","8","반전은 어느정도 예상됐던터라 놀랍진 않았는데 2번째 쿠키는 예상 못함ㅋㅋ 캡틴마블이 후속작인가?  ","빌헬미(jwjw****)","2019.07.02 13:26",8
"1299","10","가장 약하지만,현재의 피터에게 가장 강한 적.  ","양동혁(simm****)","2019.07.02 13:25",10
"1300","10","재밌음 개재밋음 그냥 재밋음 쿠키영상 2개 둘 다 충격적  ","도운(skal****)","2019.07.02 13:25",10
"1301","10","관람객존잼....항상 기대를 뛰어넘는 마블 그저갓..  ","0450(kany****)","2019.07.02 13:25",10
"1302","10","기다린보람이 있네요!!  ","HHRIN(sgmu****)","2019.07.02 13:24",10
"1303","10","아니 스파이더맨 보는데 왜 뒷자리에서 여자 혼자 이상한 위로중이야;  ","유도(yini****)","2019.07.02 13:23",10
"1304","10","역시 ㅋㅋㅋ마블은 영화를 잘 만들어 ㅋㅋ재미있넹 ㅋ  ","0161****","2019.07.02 13:22",10
"1305","9","스파이더맨 단독영화로는 재밌었음 !!!!  ","amazeunwoo(amus****)","2019.07.02 13:22",9
"1306","10","진짜 근 몇년 마블 영화중 최고였습니다  ","스튜디오그레이(stud****)","2019.07.02 13:18",10
"1307","10","아이언맨이 그립다..  ","20유학남은교(oh06****)","2019.07.02 13:11",10
"1308","10","관람객반전 대박임 ㄹㅇ ㅋㅋㅋ  ","바누아투(km73****)","2019.07.02 13:09",10
"1309","10","역시 재밌네요~흥해라  ","안소니(anso****)","2019.07.02 13:07",10
"1310","10","피터 파커 수트 만들때 토니 스타크 보였음ㅠㅠㅠ  ","syj(dbsw****)","2019.07.02 13:06",10
"1311","10","이전에 스파이더맨은  청소년 성장 드라마같았는데, 이번엔 확실히 어벤져스로 자리매김하는 영화같네요. 재밌습니다. 참고로, 예고편에 나왔던 장면이 삭제된건 많이 아쉽습니다.  ","코피칠갑(copy****)","2019.07.02 13:06",10
"1312","10","악당 시각효과 지려버렸다...  ","킹인더노쓰(pgb9****)","2019.07.02 13:04",10
"1313","10","말이 필요없다 그냥 꼭 봐라  ","블리냥(lhj8****)","2019.07.02 13:04",10
"1314","10","관람객10자를 채우기 위한 댓글러의 노오력  ","acehiter(koxd****)","2019.07.02 13:04",10
"1315","10","이거 스파이더맨 영화맞나요 너무 재미있는데?  ","김우섭(s006****)","2019.07.02 13:04",10
"1316","8","관람객잘잘  봤봤습습니니다다..  ","psh2****","2019.07.02 13:04",8
"1317","10","관람객아이언맨에서 스파이더맨으로의 성공적 계승  ","라플라스(bh25****)","2019.07.02 13:04",10
"1318","10","수세에 몰린 피터 파커. 이제 존 윅과 힘을 합칠 때. 장소는 마침 뉴욕  ","Lil Mongolist(hb54****)","2019.07.02 13:04",10
"1319","8","애기한테 진짜 너무한거 아니냐..ㅠㅜㅜ  ","감토(yjah****)","2019.07.02 13:02",8
"1320","9","미스테리오는 개인적으로 마블 빌런 top3에들어간다고 생각할정도로 인상깊었고 지루할틈없이재밌었음  ","phnmnl(juyu****)","2019.07.02 13:01",9
"1321","9","재밌다 과거 영화들의 오마주가 많다  ","ZZ10(godc****)","2019.07.02 12:59",9
"1322","10","관람객역대 최고의 마블영화라고 해도 부족하지않다  ","주현성(wngu****)","2019.07.02 12:58",10
"1323","9","토니 스타크.... 눈물 버튼.... 쿠키영상 꼭 봐야함  ","Edmond Ansel(hiha****)","2019.07.02 12:57",9
"1324","10","그냥 미쳤어요 꼭 보시길  ","이채영(bytn****)","2019.07.02 12:57",10
"1325","8","보이는 것 만 믿어서는 안된다.엔딩 크레딧이 올라간 후 다시 한번 속을 것!  ","nuki****","2019.07.02 12:57",8
"1326","10","관람객쿠키 영상 반전에 취하고 갑니다~~~  ","김령욱(thek****)","2019.07.02 12:56",10
"1327","10","개재밌다 역대급ㅋㅌㅋㅋ엔드게임이 마블팬을 위한 선물이었다면 이건 오락성이 개오짐 반전도 굿굿  ","감귤(kkr7****)","2019.07.02 12:56",10
"1328","10","관람객이게 미블이지 반전에 반잔에 반전 크으 취한다  ","레옹(dosa****)","2019.07.02 12:55",10
"1329","10","관람객시간가는줄 모르고 재미있게 봤습니다~~~  ","소핫(suel****)","2019.07.02 12:55",10
"1330","10","쿠키영상 개소름 개꿀잼  ","피피(tran****)","2019.07.02 12:54",10
"1331","10","관람객역시 번역가는 황석희님 너무 잘봤습니다또 봐야겠어요 이디스 나도 갖고싶다  ","유배우(dbck****)","2019.07.02 12:54",10
"1332","8","너무 기대하진 않는게 좋습니다  ","KATC(huns****)","2019.07.02 12:54",8
"1333","10","친절한 이웃에서 누명쓴 스파이디..ㅠ  ","이의진(xjjm****)","2019.07.02 12:54",10
"1334","10","관람객스파이더맨 쿠키는 2개입니다!! 인피니티 사가를 마무리 지은 최고의 영화입니다~~~  ","kdoy****","2019.07.02 12:53",10
"1335","10","마지막즈음 독백하는것같은 씬에서 마지막대사로 아임 스파이더맨 할줄알고 기대하고있었는데  해피랑 메이숙모 나와서 아쉽...  ","Ray(goon****)","2019.07.02 12:51",10
"1336","10","관람객청소년 히어로스럽다는 말이 어울렸다 이제는 한층 성숙된 히어로  ","박선미(ioiu****)","2019.07.02 12:51",10
"1337","10","토니스타크 가  진짜죽은거같냐??  ","그냥신(szxo****)","2019.07.02 12:51",10
"1338","10","왜 페이지3의 마지막영화인지 알게되는 영화  ","윤지혁(jihy****)","2019.07.02 12:50",10
"1339","6","인트로,쿠키,영상미빼고 중간 스토리는 좀 별로얏음  ","cand****","2019.07.02 12:50",6
"1340","10","스토리 그다지 개연성도 그다지 빌런도 그다지그러나 토니스타크의 사랑과 톰홀랜드의 매력적인 모습만으로도 10점 준다 ㅋ  ","하피하피(hspa****)","2019.07.02 12:50",10
"1341","10","그들을 추모하며...  ","tlac****","2019.07.02 12:49",10
"1342","10","관람객감사합니다 잘봤습니다.  ","sddl****","2019.07.02 12:49",10
"1343","10","토니는 없는데  아이언맨이 주인공같은 영화  ","가을야구(jjan****)","2019.07.02 12:49",10
"1344","7","해피호건: ""야 피터야, 넌 계획이 다 있구나 야.""  ","월리(dlcj****)","2019.07.02 12:49",7
"1345","10","쿠키 영상 마지막에 있을지 모르고 못봤네요한번더 보라는 얘긴가;;  ","maje****","2019.07.02 12:49",10
"1346","7","이번은 기대도 안하고 스토리도 안보고갔는데... 실망했음  ","정열의하체(oj_s****)","2019.07.02 12:48",7
"1347","10","꿀잼!!! 피터파커 넘 귀엽다 ㅠㅠ  ","ㅋㅋㅋ(slj6****)","2019.07.02 12:48",10
"1348","10","이리 구르고 저리 구르고 구른만큼 성장한 피터파커  ","엔야(lss5****)","2019.07.02 12:48",10
"1349","10","새벽에 첫상영 보고 와서... 감격.. 피터가.. 성장하고 있어요.쿠키 꼭 보세요. 세상 반가운 콜라보.  ","Mellow(riti****)","2019.07.02 12:47",10
"1350","10","토니의 선택은 최고의 선택이였다.  ","Dmitri hvorostovsky(anot****)","2019.07.02 12:47",10
"1351","7","관람객다음 마블영화가 기대되네요  ","44leaf(wheo****)","2019.07.02 12:47",7
"1352","10","다음화가 매우 기대됭ㅎ  ","김은진(eunj****)","2019.07.02 12:47",10
"1353","8","전화씹지말고 재미있으니 잼나게보세요.쿠키영상도 두개입니다.  ","너의천사(8692****)","2019.07.02 12:47",8
"1354","10","재밌고 쿠킹영상 2개나와요  ","박상현(qkrt****)","2019.07.02 12:46",10
"1355","9","지루하다 막판에 재밌고 그런거보단 어느정도의 텐션으로 쭉 재미를 끌고가는 듯한.. 잘 봤어요  ","265104163(keit****)","2019.07.02 12:46",9
"1356","10","재밋습니다 강추합니다  ","바둥바둥(thin****)","2019.07.02 12:43",10
"1357","10","아 이엠 스파이더맨!!  ","lb23****","2019.07.02 12:42",10
"1358","10","마블 영상팀은 언제나 사랑이고 헌신입니다 감사합니다! 좋은 영상물 보여주셔서!  ","하(mmmm****)","2019.07.02 12:42",10
"1359","10","관람객제이크질렌할 진짜좋아하는배우  ","달구(8cof****)","2019.07.02 12:42",10
"1360","10","지려부렸다. 꼭 한번씩들 보세요  ","dldmlcks(dmlc****)","2019.07.02 12:41",10
"1361","10","올해 본 영화중 가장 화려했고 재미 있었네요  ","아레스(ko10****)","2019.07.02 12:41",10
"1362","8","관람객마퓨파 하는 사람은 알지 미스테리오는 구라왕이라는 것을 ㅎㅎ 나도 이디스 가지고 싶다 ㅠㅠ  ","명태(gksl****)","2019.07.02 12:41",8
"1363","10","스파이더맨 당신은 대체...  ","woo(kubo****)","2019.07.02 12:40",10
"1364","10","???: 닉퓨리씨 일해라 절해라 하지 마세요.  ","뭉느(iseg****)","2019.07.02 12:38",10
"1365","10","역시 대박 재밌다 반전의 반전 또봐야지  ","Bny(gnas****)","2019.07.02 12:38",10
"1366","10","심장 쫄깃해질 만큼 재밌게 봤습니다 ㅠㅠㅠ 최고예요  ","kks0****","2019.07.02 12:37",10
"1367","9","모든 노동자들은 미스테리오를 보며 눈물을 흘렸을듯... 학생이랑 금수저는 이 맘을 몰라.  ","panz****","2019.07.02 12:37",9
"1368","8","재밌었고 스파이더맨 액션 과할 정도로 많아서 즐거웠어요  ","shcj****","2019.07.02 12:36",8
"1369","10","스파이더맨을 볼때 토니를 떠올릴 수 있거해줘서 고맙다.  ","민달팽이(als-****)","2019.07.02 12:35",10
"1370","8","관람객아들과 함께 오랫만에 재미있게 봤어요~~~  ","topl****","2019.07.02 12:35",8
"1371","10","하.. 이번주 보로간다 기대중  ","해적왕(dbse****)","2019.07.02 12:35",10
"1372","10","피터찌리릿 각성할때 쩔었음  ","실내건축고양이(oilo****)","2019.07.02 12:34",10
"1373","10","존잼 핵잼이에요ㅠㅠㅠㅠ 또 보러가야지 하 너무 재밌다 진짜  ","팬더(dbwl****)","2019.07.02 12:32",10
"1374","6","내가 보고 싶었던 건 스파이더맨이지 다음 토니 스타크가 아니었다  ","하루(s2su****)","2019.07.02 12:31",6
"1375","10","재밌습니다!!!!ㅎ  ","네오(jh90****)","2019.07.02 12:30",10
"1376","10","영상 효과가 굉장히 많은 액션씬, 빌런의 졸렬함을 느낄수있는 이번 파 프롬 홈입니다  3D로 보시길 추천드립니다  앞으로 마블이 어떻게 스토리 라인을 풀어갈지 의구심이 드는 쿠키..  ","초록코피(wjdt****)","2019.07.02 12:30",10
"1377","8","쿠키 영상 하나는 자막  다~~~끝나고 나오니,  인내심 가지고 기다리세요^^  ","나나(cykf****)","2019.07.02 12:29",8
"1378","10","스포당하기전에 아침조조로봤는데진짜 잼있어어요 역쉬마블~스타크가 피터를 정말아낀게 느껴지네요  ","황인호(ox26****)","2019.07.02 12:28",10
"1379","8","EMP 한방이면 끝이지만... 두번째 쿠키보고 왜 안쓴지 끄덕...  ","9093(yth1****)","2019.07.02 12:28",8
"1380","10","레드 제플린의 노래 최고였다!...  ","LocoTheMan(jinn****)","2019.07.02 12:27",10
"1381","10","거품 다 빼고 2시간동안 재미 있었고 뭔가 애잔 하면서도 킬링타임 지금과 같이 볼 만한 영화 많은데도 밀리지 않을 정도인 듯 난 재미있었음  ","세수하자12(haha****)","2019.07.02 12:26",10
"1382","10","피터 파커의 성장 스토리 영화  ","김이화(yyyk****)","2019.07.02 12:26",10
"1383","10","여러분 평점은 영화 끝나고 보세요.. 다 스포임;  ","상윤(tkdd****)","2019.07.02 12:25",10
"1384","10","굿굿^^~~~~ㅎㅎㅎ  ","star(sils****)","2019.07.02 12:24",10
"1385","10","쿠키영상보고 지리고 갑니다  ","인천sk(youn****)","2019.07.02 12:22",10
"1386","9","피터는 한 층 더 성장했고 역시 너무 멋있었다ㅠ 데일리 뷰글 사장님 보니까 오리지널 스파이더맨 생각도 나고 좋았음ㅎ 그리고 여전히 그리운 토니...  ","나이스(1007****)","2019.07.02 12:21",9
"1387","10","이렇게 페이즈 3을 마무리하기엔 해야 할 얘기가 너무 많은데.. 떡밥만 또 무지하게 뿌리는 마블  ","아따조타(chri****)","2019.07.02 12:19",10
"1388","8","아ㅡㅡ 쿠키영상 몬보고 나옴 다시보러가이야지 ㅋㅋ  ","승쵸리(dldh****)","2019.07.02 12:16",8
"1389","10","최고!!!다 역시 마블  ","최지웅(dndt****)","2019.07.02 12:16",10
"1390","10","관람객스파이더맨 짱ㅠㅠ 액션도 많고 존잼  ","mm(nsb1****)","2019.07.02 12:15",10
"1391","10","아제 마블영화볼때 누가나오던 다의심부터 할듯 ㅋㅋㅋㅋ  ","개구리(rlac****)","2019.07.02 12:15",10
"1392","10","I see you !!!  ","꿈틀(lsjj****)","2019.07.02 12:15",10
"1393","10","조조로 봤습니다 눈호강 귀호강 스파이더맨 체고ㅠㅠ 꼭보세요  ","차예(awwe****)","2019.07.02 12:14",10
"1394","8","왠 다이아~~피터가 토니에게 바치는 노래  ","선졔(assa****)","2019.07.02 12:14",8
"1395","10","청춘 드라마 보는 것 같이 풋풋하가도 하고 정말 재밌네요.  ","oopo****","2019.07.02 12:13",10
"1396","10","마지막까지 보길 바랍니다.반가운 인물이 등장하거든요.ㅋ  ","jyj7****","2019.07.02 12:13",10
"1397","10","Ironman everywhere.  ","르어꺼(ckco****)","2019.07.02 12:13",10
"1398","10","톰홀랜드 ㅜㅜㅜ 너무 귀여어!!!!또볼래  ","티키타카(eazy****)","2019.07.02 12:10",10
"1399","10","기존 스파이더맨 영화랑 차별화도 되면서 마블세계관에 고스란히 녹아드는 영화라니.. 중간에 아이언맨ost나올때 눈물날뻔했자낭..  ","아무무(kimp****)","2019.07.02 12:09",10
"1400","8","나는 생각한다, 고로 존재한다- Descartes  ","박윤태(qkrd****)","2019.07.02 11:57",8
"1401","10","닉퓨리 그는 도덕책....  ","쨈(aaro****)","2019.07.02 11:55",10
